{
  "$schema": "https://json-schema.org/draft/2020-12/schema",
  "$id": "https://design-pipeline.local/reference-evidence.schema.json",
  "title": "Design Pipeline Reference Evidence",
  "type": "object",
  "additionalProperties": false,
  "required": [
    "schema",
    "id",
    "source",
    "classification",
    "spatialCues",
    "route",
    "confidence",
    "requiredArtifacts",
    "approval"
  ],
  "properties": {
    "videoAnalysis": {
      "type": "object", "additionalProperties": false,
      "required": ["path", "sha256"],
      "properties": {
        "path": { "type": "string", "minLength": 1 },
        "sha256": { "type": "string", "pattern": "^[a-fA-F0-9]{64}$" }
      }
    },
    "schema": {
      "enum": [
        "design-pipeline.reference-evidence.v1",
        "design-pipeline.reference-evidence.v2"
      ]
    },
    "id": { "type": "string", "minLength": 1 },
    "source": {
      "type": "object",
      "additionalProperties": false,
      "required": ["path", "kind", "width", "height", "sha256"],
      "properties": {
        "availability": { "enum": ["resolved", "pending"], "default": "resolved" },
        "path": { "type": ["string", "null"], "minLength": 1 },
        "kind": { "enum": ["image", "video", "live-page", "document", "other"] },
        "width": { "type": ["integer", "null"], "minimum": 1 },
        "height": { "type": ["integer", "null"], "minimum": 1 },
        "sha256": { "type": ["string", "null"], "pattern": "^[a-fA-F0-9]{64}$" },
        "pendingReason": { "type": "string", "minLength": 1 },
        "requestedFrom": { "type": "string", "minLength": 1 },
        "requestedAt": { "type": "string", "format": "date-time" },
        "resolvedAt": { "type": "string", "format": "date-time" }
      },
      "allOf": [
        {
          "if": {
            "properties": { "availability": { "const": "pending" } },
            "required": ["availability"]
          },
          "then": {
            "$comment": "source contradiction: a source that was never supplied has nothing to measure, so path, width, height, and sha256 are all null under pending. Permitting a value here would let a document say the bytes never arrived while carrying the hash of those bytes.",
            "required": ["pendingReason", "requestedFrom"],
            "not": { "required": ["resolvedAt"] },
            "properties": {
              "path": { "const": null },
              "width": { "const": null },
              "height": { "const": null },
              "sha256": { "const": null }
            }
          },
          "else": {
            "properties": {
              "path": { "type": "string", "minLength": 1 },
              "width": { "type": "integer", "minimum": 1 },
              "height": { "type": "integer", "minimum": 1 },
              "sha256": { "type": "string", "pattern": "^[a-fA-F0-9]{64}$" }
            },
            "not": { "required": ["pendingReason"] }
          }
        }
      ]
    },
    "classification": {
      "type": "object",
      "additionalProperties": false,
      "required": ["objectDimensionality", "cameraModel", "interactionModel", "outputSurface", "runtimeFamily"],
      "properties": {
        "objectDimensionality": { "enum": ["2d", "2.5d", "3d"] },
        "cameraModel": { "enum": ["none", "fixed-orthographic", "fixed-perspective", "navigable-perspective"] },
        "interactionModel": { "enum": ["none", "bounded-parallax", "inspectable", "navigable"] },
        "outputSurface": { "enum": ["screen-space-ui", "locked-cinematic-frame", "interactive-scene"] },
        "runtimeFamily": { "type": "string", "minLength": 1 }
      }
    },
    "spatialCues": {
      "type": "object",
      "additionalProperties": false,
      "required": ["thickness", "occlusion", "contactShadows", "bevelHighlights", "perspectiveConvergence", "depthOfField"],
      "properties": {
        "thickness": { "$ref": "#/$defs/cue" },
        "occlusion": { "$ref": "#/$defs/cue" },
        "contactShadows": { "$ref": "#/$defs/cue" },
        "bevelHighlights": { "$ref": "#/$defs/cue" },
        "perspectiveConvergence": { "$ref": "#/$defs/cue" },
        "depthOfField": { "$ref": "#/$defs/cue" }
      }
    },
    "route": { "enum": ["2d", "2.5d", "3d", "hybrid"] },
    "confidence": { "type": "number", "minimum": 0, "maximum": 1 },
    "requiredArtifacts": {
      "type": "array",
      "minItems": 1,
      "uniqueItems": true,
      "items": { "type": "string", "minLength": 1 },
      "contains": { "const": "graybox.png" }
    },
    "approval": {
      "type": "object",
      "additionalProperties": false,
      "required": ["status", "evidence"],
      "properties": {
        "status": { "enum": ["pending", "approved", "rejected"] },
        "evidence": { "type": "string", "minLength": 1 }
      }
    },
    "intent": {
      "type": "object",
      "additionalProperties": false,
      "required": [
        "role",
        "requestedFidelity",
        "effectiveFidelity",
        "reconstructionArtifact",
        "downgrade"
      ],
      "properties": {
        "role": { "enum": ["primary-target", "constraint", "inspiration"] },
        "requestedFidelity": {
          "enum": [
            "exact-reconstruction",
            "adaptive-reconstruction",
            "directional-inspiration"
          ]
        },
        "effectiveFidelity": {
          "enum": [
            "exact-reconstruction",
            "adaptive-reconstruction",
            "directional-inspiration"
          ]
        },
        "reconstructionArtifact": {
          "type": ["string", "null"],
          "minLength": 1
        },
        "downgrade": {
          "type": "object",
          "additionalProperties": false,
          "required": ["status", "evidence"],
          "properties": {
            "status": {
              "enum": ["not-requested", "pending-user", "approved-by-user"]
            },
            "evidence": { "type": "string", "minLength": 1 }
          }
        }
      }
    },
    "composition": {
      "type": "object",
      "additionalProperties": false,
      "required": ["uniform", "regions"],
      "properties": {
        "uniform": { "type": "boolean" },
        "regions": {
          "type": "array",
          "minItems": 2,
          "items": {
            "type": "object",
            "additionalProperties": false,
            "required": ["id", "rows", "columns", "breaksFrom"],
            "properties": {
              "id": { "type": "string", "minLength": 1 },
              "rows": { "type": "integer", "minimum": 1 },
              "columns": { "type": "integer", "minimum": 1 },
              "contents": { "$ref": "#/$defs/regionContents" },
              "breaksFrom": {
                "type": "array",
                "uniqueItems": true,
                "items": { "type": "string", "minLength": 1 }
              }
            }
          }
        }
      },
      "allOf": [
        {
          "$comment": "composition contradiction: contents absent from every region is a composition written before the field existed and stays valid. Contents on some regions and not others is a document that adopted the field and then declined to answer for one region, which is the back-reference dodge with an empty cell in place of the words.",
          "if": {
            "required": ["regions"],
            "properties": {
              "regions": { "contains": { "required": ["contents"] } }
            }
          },
          "then": {
            "properties": {
              "regions": { "items": { "required": ["contents"] } }
            }
          }
        },
        {
          "if": {
            "properties": { "uniform": { "const": true } },
            "required": ["uniform"]
          },
          "then": {
            "properties": {
              "regions": {
                "items": {
                  "properties": { "breaksFrom": { "maxItems": 0 } }
                }
              }
            }
          },
          "else": {
            "properties": {
              "regions": {
                "contains": {
                  "type": "object",
                  "required": ["breaksFrom"],
                  "properties": { "breaksFrom": { "minItems": 1 } }
                }
              }
            }
          }
        }
      ]
    },
    "graybox": {
      "type": "object",
      "additionalProperties": false,
      "required": ["capture", "capturedAt", "viewport", "suppressed", "comparison", "approval"],
      "properties": {
        "capture": { "type": "string", "minLength": 1 },
        "capturedAt": { "type": "string", "format": "date-time" },
        "runtimeMode": {
          "oneOf": [
            { "type": "null" },
            { "type": "string", "minLength": 1 },
            {
              "type": "object",
              "additionalProperties": false,
              "required": ["mechanism", "token", "disables"],
              "properties": {
                "mechanism": {
                  "enum": [
                    "root-attribute",
                    "query-parameter",
                    "build-flag",
                    "runtime-api"
                  ]
                },
                "token": { "type": "string", "minLength": 1 },
                "disables": {
                  "type": "array",
                  "minItems": 1,
                  "uniqueItems": true,
                  "items": { "type": "string", "minLength": 1 }
                }
              }
            }
          ]
        },
        "viewport": {
          "type": "object",
          "additionalProperties": false,
          "required": ["width", "height"],
          "properties": {
            "width": { "type": "integer", "minimum": 1 },
            "height": { "type": "integer", "minimum": 1 }
          }
        },
        "suppressed": {
          "type": "array",
          "minItems": 1,
          "uniqueItems": true,
          "items": {
            "enum": ["materials", "glow", "bloom", "depth-of-field", "scanlines", "grading"]
          }
        },
        "comparison": {
          "type": "object",
          "additionalProperties": false,
          "required": ["mode", "regions"],
          "properties": {
            "mode": { "enum": ["measured", "qualitative"] },
            "regions": {
              "type": "array",
              "items": {
                "type": "object",
                "additionalProperties": false,
                "required": ["id", "finding", "status"],
                "properties": {
                  "id": { "type": "string", "minLength": 1 },
                  "finding": { "type": "string", "minLength": 1 },
                  "status": { "enum": ["matches", "corrected", "accepted-deviation", "open"] }
                }
              }
            }
          }
        },
        "approval": {
          "type": "object",
          "additionalProperties": false,
          "required": ["status", "evidence"],
          "properties": {
            "status": { "enum": ["pending", "approved", "rejected"] },
            "evidence": { "type": "string", "minLength": 1 }
          }
        }
      }
    }
  },
  "allOf": [
    {
      "if": { "required": ["videoAnalysis"] },
      "then": { "properties": { "source": { "properties": { "kind": { "enum": ["video", "image"] } } } } }
    },
    {
      "$comment": "schema era mismatch: v1 is a frozen legacy carrier. A v1 document that stays inside the v1 feature set keeps validating without intent or composition, because that absence is a real signal about an older document. A v1 document that carries a v2-era construct (intent, or a graybox block whose comparison is bound to composition region ids) is current work wearing a stale version label, so it is held to the v2 contract instead of using v1 to switch those checks off.",
      "if": {
        "properties": {
          "schema": { "const": "design-pipeline.reference-evidence.v1" }
        },
        "required": ["schema"],
        "anyOf": [
          { "required": ["intent"] },
          { "required": ["graybox"] }
        ]
      },
      "then": {
        "required": ["intent", "composition"]
      }
    },
    {
      "if": {
        "properties": {
          "schema": { "const": "design-pipeline.reference-evidence.v2" }
        },
        "required": ["schema"]
      },
      "then": {
        "required": ["intent", "composition"]
      }
    }
  ],
  "$defs": {
    "regionContents": {
      "$comment": "composition back-reference: a short left-to-right description of what the region holds, authored from the reference. `as above`, `same as previous`, `see above`, `ditto`, `idem`, and equivalents defer to a neighbouring row instead of reading this region, which is the failure the per-region checklist exists to catch. The pattern is written as explicit letter classes because JSON Schema patterns carry no case-insensitive flag.",
      "type": "string",
      "minLength": 1,
      "not": {
        "pattern": "\\b([Aa][Ss][ \\t]+[Aa][Bb][Oo][Vv][Ee]|[Ss][Aa][Mm][Ee][ \\t]+[Aa][Ss]|[Ss][Ee][Ee][ \\t]+[Aa][Bb][Oo][Vv][Ee]|[Dd][Ii][Tt][Tt][Oo]|[Ii][Dd][Ee][Mm])\\b"
      }
    },
    "cue": {
      "type": "object",
      "additionalProperties": false,
      "required": ["present", "evidence"],
      "properties": {
        "present": { "type": "boolean" },
        "evidence": { "type": "string", "minLength": 1 }
      }
    }
  }
}
